{
  "3xs": {
    "value": ".75rem",
    "type": "rootFontSize",
    "description": "Smallest font size.",
    "a11y": "--zbk-a11y-font-size-modifier-3xs"
  },
  "2xs": {
    "value": ".82rem",
    "type": "rootFontSize",
    "description": "Second smallest font size.",
    "a11y": "--zbk-a11y-font-size-modifier-2xs"
  },
  "xs": {
    "value": ".9rem",
    "type": "rootFontSize",
    "description": "Extra small font size.",
    "a11y": "--zbk-a11y-font-size-modifier-xs"
  },
  "sm": {
    "value": "1rem",
    "type": "rootFontSize",
    "description": "Small font size.",
    "a11y": "--zbk-a11y-font-size-modifier-sm"
  },
  "md": {
    "value": "1.125rem",
    "type": "rootFontSize",
    "description": "Medium font size.",
    "a11y": "--zbk-a11y-font-size-modifier-md"
  },
  "lg": {
    "value": "1.5rem",
    "type": "rootFontSize",
    "description": "Large font size.",
    "a11y": "--zbk-a11y-font-size-modifier-lg"
  },
  "xl": {
    "value": "2rem",
    "type": "rootFontSize",
    "description": "Extra large font size.",
    "a11y": "--zbk-a11y-font-size-modifier-xl"
  },
  "2xl": {
    "value": "2.6rem",
    "type": "rootFontSize",
    "description": "Double extra large font size.",
    "a11y": "--zbk-a11y-font-size-modifier-2xl"
  },
  "3xl": {
    "value": "3.5rem",
    "type": "rootFontSize",
    "description": "Triple extra large font size.",
    "a11y": "--zbk-a11y-font-size-modifier-3xl"
  }
}
