{
  "3xs": {
    "value": "0.625rem",
    "type": "rootFontSize"
  },
  "2xs": {
    "value": "0.75rem",
    "type": "rootFontSize"
  },
  "xs": {
    "value": "0.8125rem",
    "type": "rootFontSize"
  },
  "sm": {
    "value": "0.875rem",
    "type": "rootFontSize"
  },
  "md": {
    "value": "1rem",
    "type": "rootFontSize"
  },
  "lg": {
    "value": "1.25rem",
    "type": "rootFontSize"
  },
  "xl": {
    "value": "1.5rem",
    "type": "rootFontSize"
  },
  "2xl": {
    "value": "1.75rem",
    "type": "rootFontSize"
  },
  "3xl": {
    "value": "2.5rem",
    "type": "rootFontSize"
  },
  "4xl": {
    "value": "3.25rem",
    "type": "rootFontSize"
  },
  "5xl": {
    "value": "4.25rem",
    "type": "rootFontSize"
  }
}
