{
  "3xs": {
    "value": ".75rem",
    "type": "rootFontSize"
  },
  "2xs": {
    "value": ".82rem",
    "type": "rootFontSize"
  },
  "xs": {
    "value": ".9rem",
    "type": "rootFontSize"
  },
  "sm": {
    "value": "12px",
    "type": "rootFontSize"
  },
  "md": {
    "value": "17px",
    "type": "rootFontSize"
  },
  "lg": {
    "value": "22px",
    "type": "rootFontSize"
  },
  "xl": {
    "value": "28px",
    "type": "rootFontSize"
  },
  "2xl": {
    "value": "40px",
    "type": "rootFontSize"
  },
  "3xl": {
    "value": "56px",
    "type": "rootFontSize"
  },
    "4xl": {
    "value": "64px",
    "type": "rootFontSize"
  },
    "5xl": {
    "value": "80px",
    "type": "rootFontSize"
  }
}